{
  "format": "slothboss-backup",
  "formatVersion": 1,
  "schemaVersion": 1,
  "exportedAt": "2026-10-20T12:00:00.000Z",
  "generator": "fixture",
  "pages": [
    {
      "id": "0b0c6a52-0d6f-4a37-9b67-3f0f1c2b1a10",
      "parentId": null,
      "title": "Background",
      "content": {"version":1,"blocks":[{"type":"paragraph","spans":[{"text":"Local models keep data private."}]}]},
      "sortOrder": 1,
      "createdAt": "2026-10-20T10:00:00.000Z",
      "updatedAt": "2026-10-20T10:00:00.000Z",
      "isFavorite": true,
      "isArchived": false
    },
    {
      "id": "6f1d2c3b-4a59-4e7f-8a1b-2c3d4e5f6a7b",
      "parentId": "0b0c6a52-0d6f-4a37-9b67-3f0f1c2b1a10",
      "title": "Experiments",
      "content": {"version":1,"blocks":[{"type":"paragraph","spans":[{"text":"See "},{"text":"Background","link":"slothboss://page/0b0c6a52-0d6f-4a37-9b67-3f0f1c2b1a10"}]}]},
      "sortOrder": 1,
      "createdAt": "2026-10-20T10:05:00.000Z",
      "updatedAt": "2026-10-20T10:06:00.000Z",
      "isFavorite": false,
      "isArchived": false
    }
  ],
  "tasks": [
    {
      "id": "9a8b7c6d-5e4f-4a3b-8c2d-1e0f9a8b7c6d",
      "title": "Benchmark latency",
      "description": "Compare cold and warm starts",
      "status": "done",
      "priority": "high",
      "dueDate": "2026-10-25",
      "pageId": "6f1d2c3b-4a59-4e7f-8a1b-2c3d4e5f6a7b",
      "createdAt": "2026-10-20T10:10:00.000Z",
      "updatedAt": "2026-10-20T11:00:00.000Z",
      "completedAt": "2026-10-20T11:00:00.000Z"
    },
    {
      "id": "1b2c3d4e-5f6a-4b7c-8d9e-0f1a2b3c4d5e",
      "title": "Standalone task",
      "description": null,
      "status": "todo",
      "priority": "low",
      "dueDate": null,
      "pageId": null,
      "createdAt": "2026-10-20T10:20:00.000Z",
      "updatedAt": "2026-10-20T10:20:00.000Z",
      "completedAt": null
    }
  ]
}
